{
  "$schema": "http://json-schema.org/draft-04/schema#",
  "title": "Run Module Specification",
  "description": "Common specification for stream-juggler modules that can be run",
  "definitions": {
    "source": {
      "type": "object",
      "properties": {
        "cardinality": {
          "description": "The boundary of interval in that a number of inputs can change",
          "type": "array",
          "items": {
            "type": "number",
            "minimum": 0
          },
          "minItems": 2,
          "maxItems": 2
        },
        "types": {
          "description": "The enumeration of types of inputs",
          "type": "array",
          "items": {
            "type": "string",
            "enum": [
              "stream.t-stream",
              "stream.kafka",
              "elasticsearch-output",
              "jdbc-output"
            ]
          }
        }
      },
      "required": [
        "cardinality",
        "types"
      ]
    }
  },
  "type": "object",
  "properties": {
    "name": {
      "description": "The unique name for a module",
      "type": "string"
    },
    "description": {
      "description": "The description for a module",
      "type": "string"
    },
    "version": {
      "description": "The module version",
      "type": "string"
    },
    "author": {
      "description": "The module author",
      "type": "string"
    },
    "license": {
      "description": "The software license type for a module",
      "type": "string"
    },
    "inputs": {
      "description": "The specification for the inputs of a module",
      "$ref": "#/definitions/source"
    },
    "outputs": {
      "description": "The specification for the outputs of a module",
      "$ref": "#/definitions/source"
    },
    "module-type": {
      "description": "The type of a module",
      "type": "string",
      "enum": [
        "regular-streaming",
        "windowed-streaming",
        "output-streaming"
      ]
    },
    "engine-name": {
      "description": "The name of the computing core of a module",
      "type": "string"
    },
    "engine-version": {
      "description": "The version of the computing core of a module",
      "type": "string"
    },
    "options": {
      "description": "The json-schema for some optional parameters",
      "type": "object"
    },
    "validator-class": {
      "description": "The absolute path to class that is responsible for a validation of launch options",
      "type": "string"
    },
    "executor-class": {
      "description": "The absolute path to class that is responsible for a running of module",
      "type": "string"
    }
  },
  "required": [
    "name",
    "inputs",
    "outputs",
    "module-type",
    "options",
    "validator-class",
    "executor-class"
  ]
}