{
  "name": "windowed-streaming-stub",
  "description": "Stub module by BW",
  "version": "1.0",
  "author": "Ksenia Mikhaleva",
  "license": "Apache 2.0",
  "inputs": {
    "cardinality": [
      1,
      10
    ],
    "types": [
      "stream.kafka",
      "stream.t-stream"
    ]
  },
  "outputs": {
    "cardinality": [
      1,
      10
    ],
    "types": [
      "stream.t-stream"
    ]
  },
  "module-type": "windowed-streaming",
  "engine-name": "com.bwsw.windowed.streaming.engine",
  "engine-version": "1.0",
  "options": {
    "opt": 1
  },
  "validator-class": "com.bwsw.sj.stubs.module.windowed_streaming.Validator",
  "executor-class": "com.bwsw.sj.stubs.module.windowed_streaming.Executor"
}
